{"$schema":"https://json-schema.org/draft/2020-12/schema","type":"object","additionalProperties":false,"required":["schemaVersion","semanticRoles","foundation","palettes","themes"],"properties":{"schemaVersion":{"const":1},"semanticRoles":{"type":"array","uniqueItems":true},"foundation":{"type":"object"},"palettes":{"type":"object"},"themes":{"type":"array"}}}
