{
  "schemaVersion": 1,
  "semanticRoles": [
    "action.destructive", "action.on-destructive", "action.on-primary", "action.primary", "action.primary-active", "action.primary-hover",
    "border.default", "border.destructive", "border.selected", "border.strong",
    "status.armed", "status.blackout", "status.frame-lock", "status.live", "status.offline", "status.on-armed", "status.on-blackout", "status.on-frame-lock", "status.on-live", "status.on-offline", "status.on-revoked", "status.revoked",
    "surface.canvas", "surface.control", "surface.overlay", "surface.panel", "surface.panel-subdued", "surface.scrim", "surface.selected",
    "text.inverse", "text.link", "text.muted", "text.primary", "text.secondary"
  ],
  "foundation": {
    "typography": { "fontFamilyMono": "JetBrains Mono, monospace", "fontFamilyUi": "Archivo, sans-serif", "fontSizeBody": "14px", "fontSizeCompact": "11px", "fontSizeDisplay": "28px", "fontSizeHeading": "20px", "fontWeightRegular": "400", "fontWeightSemibold": "600", "lineHeightBody": "1.5", "lineHeightHeading": "1.2" },
    "spacing": { "space1": "4px", "space2": "8px", "space4": "16px", "space6": "24px", "space8": "32px", "space12": "48px", "space16": "64px", "guidedFirstShowGap": "8px" },
    "radii": { "large": "12px", "medium": "8px", "pill": "999px", "small": "4px" },
    "sizing": { "controlCompact": "28px", "controlDefault": "32px", "controlMinimumTarget": "44px", "controlSafety": "64px", "guidedFirstShowStageRail": "210px", "icon12": "12px", "icon16": "16px", "icon20": "20px", "icon24": "24px" },
    "focus": { "color": "#456ede", "offset": "2px", "ring": "2px" },
    "motion": { "settle": "200ms ease", "snap": "0ms", "tap": "120ms ease-out" },
    "stacking": { "base": "0", "emergencyOverlay": "100", "modal": "80", "popover": "60", "stickyChrome": "40" }
  },
  "palettes": {
    "paper-ink-light": { "action.destructive": "#e23a2e", "action.on-destructive": "#f4f1eb", "action.on-primary": "#f4f1eb", "action.primary": "#1b44d9", "action.primary-active": "#1233a8", "action.primary-hover": "#1233a8", "border.default": "#d2ccc0", "border.destructive": "#e23a2e", "border.selected": "#1b44d9", "border.strong": "#57564e", "status.armed": "#c8a24b", "status.blackout": "#17181c", "status.frame-lock": "#5ac26a", "status.live": "#1b44d9", "status.offline": "#8a887f", "status.on-armed": "#17181c", "status.on-blackout": "#f4f1eb", "status.on-frame-lock": "#17181c", "status.on-live": "#f4f1eb", "status.on-offline": "#17181c", "status.on-revoked": "#f4f1eb", "status.revoked": "#e23a2e", "surface.canvas": "#e4e0d8", "surface.control": "#f4f1eb", "surface.overlay": "#f4f1eb", "surface.panel": "#f4f1eb", "surface.panel-subdued": "#f1ece6", "surface.scrim": "rgba(23, 24, 28, 0.56)", "surface.selected": "#dbe2fb", "text.inverse": "#f4f1eb", "text.link": "#1b44d9", "text.muted": "#8a887f", "text.primary": "#17181c", "text.secondary": "#4a4941" },
    "paper-ink-dark": { "action.destructive": "#e23a2e", "action.on-destructive": "#f4f1eb", "action.on-primary": "#f4f1eb", "action.primary": "#1b44d9", "action.primary-active": "#1233a8", "action.primary-hover": "#1233a8", "border.default": "#2e3038", "border.destructive": "#e23a2e", "border.selected": "#1b44d9", "border.strong": "#a6a49b", "status.armed": "#c8a24b", "status.blackout": "#17181c", "status.frame-lock": "#5ac26a", "status.live": "#1b44d9", "status.offline": "#87857d", "status.on-armed": "#17181c", "status.on-blackout": "#f4f1eb", "status.on-frame-lock": "#17181c", "status.on-live": "#f4f1eb", "status.on-offline": "#17181c", "status.on-revoked": "#f4f1eb", "status.revoked": "#e23a2e", "surface.canvas": "#131419", "surface.control": "#1e2027", "surface.overlay": "#1e2027", "surface.panel": "#1e2027", "surface.panel-subdued": "#1b1c23", "surface.scrim": "rgba(0, 0, 0, 0.64)", "surface.selected": "#252d4b", "text.inverse": "#17181c", "text.link": "#8da6ff", "text.muted": "#87857d", "text.primary": "#eceae3", "text.secondary": "#b7b5ac" },

    "gruvbox-light": { "action.destructive": "#e23a2e", "action.on-destructive": "#f4f1eb", "action.on-primary": "#f4f1eb", "action.primary": "#af3a03", "action.primary-active": "#7a2902", "action.primary-hover": "#7a2902", "border.default": "#d5c4a1", "border.destructive": "#e23a2e", "border.selected": "#af3a03", "border.strong": "#504945", "status.armed": "#c8a24b", "status.blackout": "#17181c", "status.frame-lock": "#5ac26a", "status.live": "#1b44d9", "status.offline": "#8a887f", "status.on-armed": "#17181c", "status.on-blackout": "#f4f1eb", "status.on-frame-lock": "#17181c", "status.on-live": "#f4f1eb", "status.on-offline": "#17181c", "status.on-revoked": "#f4f1eb", "status.revoked": "#e23a2e", "surface.canvas": "#ebdbb2", "surface.control": "#fbf1c7", "surface.overlay": "#fbf1c7", "surface.panel": "#fbf1c7", "surface.panel-subdued": "#f2e5bc", "surface.scrim": "rgba(0, 0, 0, 0.56)", "surface.selected": "#f5e2d3", "text.inverse": "#f4f1eb", "text.link": "#af3a03", "text.muted": "#7c6f64", "text.primary": "#282828", "text.secondary": "#3c3836" },
    "gruvbox-dark": { "action.destructive": "#e23a2e", "action.on-destructive": "#f4f1eb", "action.on-primary": "#17181c", "action.primary": "#fe8019", "action.primary-active": "#d65d0e", "action.primary-hover": "#d65d0e", "border.default": "#504945", "border.destructive": "#e23a2e", "border.selected": "#fe8019", "border.strong": "#d5c4a1", "status.armed": "#c8a24b", "status.blackout": "#17181c", "status.frame-lock": "#5ac26a", "status.live": "#1b44d9", "status.offline": "#8a887f", "status.on-armed": "#17181c", "status.on-blackout": "#f4f1eb", "status.on-frame-lock": "#17181c", "status.on-live": "#f4f1eb", "status.on-offline": "#17181c", "status.on-revoked": "#f4f1eb", "status.revoked": "#e23a2e", "surface.canvas": "#1b1d1e", "surface.control": "#2e2c2b", "surface.overlay": "#2e2c2b", "surface.panel": "#2e2c2b", "surface.panel-subdued": "#252525", "surface.scrim": "rgba(0, 0, 0, 0.64)", "surface.selected": "#4a3826", "text.inverse": "#17181c", "text.link": "#fe8019", "text.muted": "#a89984", "text.primary": "#fbf1c7", "text.secondary": "#ebdbb2" },

    "tokyo-light": { "action.destructive": "#e23a2e", "action.on-destructive": "#f4f1eb", "action.on-primary": "#f4f1eb", "action.primary": "#34548a", "action.primary-active": "#1a3a66", "action.primary-hover": "#1a3a66", "border.default": "#b4b5c9", "border.destructive": "#e23a2e", "border.selected": "#34548a", "border.strong": "#6c7086", "status.armed": "#c8a24b", "status.blackout": "#17181c", "status.frame-lock": "#5ac26a", "status.live": "#1b44d9", "status.offline": "#8a887f", "status.on-armed": "#17181c", "status.on-blackout": "#f4f1eb", "status.on-frame-lock": "#17181c", "status.on-live": "#f4f1eb", "status.on-offline": "#17181c", "status.on-revoked": "#f4f1eb", "status.revoked": "#e23a2e", "surface.canvas": "#d5d6db", "surface.control": "#e9e9ed", "surface.overlay": "#e9e9ed", "surface.panel": "#e9e9ed", "surface.panel-subdued": "#dfe0e5", "surface.scrim": "rgba(0, 0, 0, 0.56)", "surface.selected": "#d8dfec", "text.inverse": "#f4f1eb", "text.link": "#34548a", "text.muted": "#767ea6", "text.primary": "#343b58", "text.secondary": "#4c5273" },
    "tokyo-dark": { "action.destructive": "#e23a2e", "action.on-destructive": "#f4f1eb", "action.on-primary": "#17181c", "action.primary": "#7aa2f7", "action.primary-active": "#3d59a1", "action.primary-hover": "#3d59a1", "border.default": "#3b4261", "border.destructive": "#e23a2e", "border.selected": "#7aa2f7", "border.strong": "#9aa5ce", "status.armed": "#c8a24b", "status.blackout": "#17181c", "status.frame-lock": "#5ac26a", "status.live": "#1b44d9", "status.offline": "#8a887f", "status.on-armed": "#17181c", "status.on-blackout": "#f4f1eb", "status.on-frame-lock": "#17181c", "status.on-live": "#f4f1eb", "status.on-offline": "#17181c", "status.on-revoked": "#f4f1eb", "status.revoked": "#e23a2e", "surface.canvas": "#16161e", "surface.control": "#24283b", "surface.overlay": "#24283b", "surface.panel": "#24283b", "surface.panel-subdued": "#1a1b26", "surface.scrim": "rgba(0, 0, 0, 0.64)", "surface.selected": "#2c3a5c", "text.inverse": "#17181c", "text.link": "#7aa2f7", "text.muted": "#6a74a1", "text.primary": "#c0caf5", "text.secondary": "#a9b1d6" },

    "dracula-light": { "action.destructive": "#e23a2e", "action.on-destructive": "#f4f1eb", "action.on-primary": "#f4f1eb", "action.primary": "#7c4dc9", "action.primary-active": "#5c37a0", "action.primary-hover": "#5c37a0", "border.default": "#d6d3e6", "border.destructive": "#e23a2e", "border.selected": "#7c4dc9", "border.strong": "#4d4f68", "status.armed": "#c8a24b", "status.blackout": "#17181c", "status.frame-lock": "#5ac26a", "status.live": "#1b44d9", "status.offline": "#8a887f", "status.on-armed": "#17181c", "status.on-blackout": "#f4f1eb", "status.on-frame-lock": "#17181c", "status.on-live": "#f4f1eb", "status.on-offline": "#17181c", "status.on-revoked": "#f4f1eb", "status.revoked": "#e23a2e", "surface.canvas": "#e8e6f0", "surface.control": "#f8f8f2", "surface.overlay": "#f8f8f2", "surface.panel": "#f8f8f2", "surface.panel-subdued": "#f0eff7", "surface.scrim": "rgba(0, 0, 0, 0.56)", "surface.selected": "#ebe0f7", "text.inverse": "#f4f1eb", "text.link": "#7c4dc9", "text.muted": "#6272a4", "text.primary": "#282a36", "text.secondary": "#44475a" },